ID,Sentence
941,କୁହୁଡିରେ ଆମେ ହଜିଗଲୁ |
942,ଆମ ପାଖରେ କିଛି ବହି ଅଛି |
943,ଗୋଟିଏ ହାତରେ ଆମର ପାଞ୍ଚଟି ଆଙ୍ଗୁଠି ଅଛି |
944,ଆମର ଦୁଇଟି ଆଖି ଅଛି |
945,ଆମେ ହସୁ କାରଣ ଏହା ମଜାଳିଆ ଅଟେ |
946,ଆମେ ପରସ୍ପରକୁ ଭଲପାଏ |
947,ଫସଲ ପାଇଁ ଆମକୁ ବର୍ଷା ଦରକାର |
948,ଆମର ଫସଲ ପାଇଁ ଜଳ ଦରକାର |
949,ଆମକୁ ପିଇବା ପାଇଁ ପାଣି ଦରକାର |
950,ଆମେ ଘରକୁ ସବୁଜ ରଙ୍ଗ ଦେଇଥିଲୁ |
951,ଆମେ କାଦୁଅରେ ଖେଳିଲୁ |
952,ଆମେ ଆମର ବୟସ୍କ ମାନଙ୍କୁ ସମ୍ମାନ କରୁ |
953,ତାଙ୍କର ମୃତ୍ୟୁ ଆମେ ଦେଖିଲୁ |
954,ଆମେ ନୂଆ ଶିଶୁକୁ ଦେଖିଲୁ |
955,ଆମେ କିଛି ଖାଦ୍ୟ କିଣିବା ଉଚିତ୍ |
956,ଆମ୍ବକୁ ଏକ ବ୍ୟାଗରେ ରଖିବା ଉଚିତ୍ |
957,ଆମେ ଅଧା ଅଧା ବାଣ୍ଟି ହୋଇଯିବା ଉଚିତ୍ |
958,ଆମେ ବେଳେବେଳେ ହ୍ରଦରେ ପହଁରିବା |
959,ଆମେ ନଦୀ ପାର ହୋଇ ଅନ୍ୟ କୂଳକୁ ଗଲୁ |
960,ଆମେ ପହଁରି ହ୍ରଦରେ ଖେଳିଲୁ |
961,ଆମେ ସେଠାରେ ଥିବା ମନ୍ଦିର ପରିଦର୍ଶନ କରିବାକୁ ଚାହୁଁଛୁ |
962,ଆମେ ସେଠାରେ ଥିବା ମନ୍ଦିର ପରିଦର୍ଶନ କରିବାକୁ ଚାହୁଁଛୁ |
963,ଆମେ ପୋଷାକ ଧୋଇବା ପାଇଁ ନଦୀକୁ ଗଲୁ |
964,ଆସନ୍ତାକାଲି ଆମକୁ ଭଲ ଅମଳ ମିଳିବ |
965,ଆସନ୍ତାକାଲି ଆମେ ଦିଲ୍ଲୀ ଯିବୁ ନାହିଁ
966,ଅନା ବନା ଘାସ ଫସଲ ପାଇଁ ଭଲ ନୁହେଁ |
967,ସେ କ’ଣ ଖାଇଲେ?
968,ସୀମା ସେମାନଙ୍କୁ କ’ଣ କହିଥିଲେ?
969,ସେ କ’ଣ କହିଲା?
970,ସେମାନେ କ’ଣ ପଚାରିଲେ?
971,ସେମାନେ କ’ଣ ମାଗିଲେ?
972,ତୁମେ କ’ଣ ଦେଖିଲ?
973,ଆପଣ ଭାବୁଥିବେ ସେ କ’ଣ ଭାବୁଥିଲେ?
974,ଗତ ରାତିରେ କ’ଣ ହେଲା?
975,ଯଦି ତୁମେ ଭିଜି ଯିବ ତେବେ କଣ ହେବ?
976,ତୁମେ କ’ଣ ପାଇଁ ଆସିଛ?
977,ଏହି ପାତ୍ରର ମୂଲ୍ୟ କେତେ?
978,ମୁଣ୍ଡ ବିନ୍ଧାର ଚିକିତ୍ସା କ’ଣ?
979,ତୁମର ପ୍ରିୟ ରଙ୍ଗ କ’ଣ?
980,ତୁମର ନାମ କଣ?
981,ଏହା କି ପ୍ରକାର ମାଛ?
982,ମୁଁ କ’ଣ ଗାଇବି?
983,ସେ କ’ଣ ଖାଇଲେ?
984,ଆପଣ କେବେ ଅନ୍ତିମ ସଂସ୍କାର କରିବାକୁ ଆସୁଛନ୍ତି |
985,ଆପଣ କେବେ ଘରକୁ ଯାଉଛନ୍ତି?
986,ମୁଁ କେବେ ଖାଦ୍ୟ ପାଇବି |
987,ମାମୁଁ କେତେବେଳେ ଗଲେ ?
988,ଆପଣ କେବେ ଗୀତ ଗାଇବାକୁ ପସନ୍ଦ କରନ୍ତି |
989,ତୁମେ କେବେ ଶୋଇବ?
990,"ଯେତେବେଳେ ସୂର୍ଯ୍ୟ ଅସ୍ତ ହୁଏ, ଅନ୍ଧାର ହୋଇଯାଏ |"
991,ଜଳ ଥଣ୍ଡା ହେଲେ ଏହା ବରଫ ହୋଇଯାଏ |
992,ଆପଣ କେବେ ରାଞ୍ଚି ଯିବେ?
993,ତୁମେ କେବେ ବିହନ ବୁଣିବ?
994,ଆପଣ କେଉଁଠାରେ ରହିବାକୁ ଯାଉଛନ୍ତି?
995,ରାମ ସୀତାଙ୍କ ଅଳଙ୍କାର କେଉଁଠୁ ପାଇଲେ?
996,ତୁମେ ଟୋକେଇଟି କେଉଁଠୁ ପାଇଲ?
997,ତୁମେ ଏହି ପକ୍ଷୀମାନଙ୍କୁ କେଉଁଠୁ ପାଇଲ?
998,ଆପଣ କେଉଁଠାରେ ବାସ କରନ୍ତି?
999,ଆପଣ କେଉଁଠାରେ ରହିବେ?
1000,ଭାଇ କେଉଁଠାରେ?
1001,ଜଙ୍ଗଲ କେଉଁଠାରେ ଅଛି |
1002,କେଉଁ ଫଳର ଭଲ ପୋଷକ ତତ୍ତ୍ୱ ଅଛି?
1003,ତୁମର ଭାଇ କିଏ?
1004,"ଯେତେବେଳେ ସେ ଦେଖୁଥିଲେ, ଚୋରମାନେ ଟଙ୍କା ନେଇ ଦୌଡି ପଳାଇଲେ |"
1005,"ଯେତେବେଳେ ସେ ଦେଖୁଥିଲେ, ଚୋରମାନେ ଟଙ୍କା ସହିତ ବନ୍ଧା ହେଲେ|"
1006,ଯେତେବେଳେ ତୁମେ ପତ୍ର ଛିଣ୍ଡାଇବ ସେଠାରୁ ଧଳା ରସ ବାହାରିବ |
1007,ସମସ୍ତେ ବିବାହକୁ ଆସିଥିଲେ କି?
1008,କିଏ ଭଲ ଖାଇବାକୁ ପସନ୍ଦ କରେ ନାହିଁ?
1009,ସେ କିଏ?
1010,ତୁମର ଭାଇ କିଏ?
1011,ତୁମର ପିତା କିଏ?
1012,କିଏ ମଇଳା ପାତ୍ରଗୁଡିକ ଏଠାରେ ରଖିଲା?
1013,ଏଠାରେ କିଏ ଫାଉଡା (କୋଡି) ରଖିଲା ?
1014,ଯିଏ କବାଟ ବାଡେଇଥାଏ |
1015,କିଏ ଆଖୁ ଖାଇବାକୁ ପସନ୍ଦ କରେ?
1016,କିଏ ବାହାରକୁ ଯିବାକୁ ଚାହୁଁଛି |
1017,ଆପଣ କାହିଁକି ଦିଲ୍ଲୀ ଯାଉଛନ୍ତି?
1018,ଗରୁଡ ପକ୍ଷୀ କାହିଁକି ଏତେ ଉଚ୍ଚରେ ଉଡେ?
1019,ମୁଁ ତାଙ୍କୁ କାହିଁକି ପିଟିବି?
1020,ଆପଣ କାହିଁକି କହିବେ?
1021,ବନ୍ୟଜନ୍ତୁମାନେ ମାଂସ ଖାଆନ୍ତି
1022,ଆଜି ଆପଣ ଘରେ ରୋଷେଇ କରିବେ କି?
1023,ଚଟାଣ ପୋଛି ଦିଅ |
1024,ମୁହଁରୁ ଲୁହ ପୋଛି ଦିଅ |
1025,ଏହି କପଡା ବ୍ୟବହାର କରି ପାଦ ପୋଛି ଦିଅ |
1026,ଗଧିଆମାନେ ମିଳିତ ଭାବେ ଶିକାର କରନ୍ତି |
1027,ସ୍ତ୍ରୀ ସମସ୍ତ ଘର କାମ କରେ |
1028,ମହିଳା ମାନେ ଏଠାରେ ହାର ଏବଂ ନାକଫୁଲ ପିନ୍ଧନ୍ତି |
1029,କୀଟ ଚାଷୀଙ୍କ ଶସ୍ୟ ଖାଏ |
1030,ଆପଣ ସେହି ଦୂରତା ଚାଲିବେ କି?
1031,ଆପଣ ସେହି ଦୂରତା ଚାଲିବେ କି?
1032,ହଳଦିଆ ପତ୍ର ସୁନ୍ଦର ଅଟେ |
1033,ଗତକାଲି ମୁଁ ଏକ ବାଉଁଶ ବାଡ଼ ତିଆରି କଲି |
1034,ଝିଅ ତୁମେ ଜଣେ ଚତୁର ଝିଅ I
1035,ତୁମେ ଲକ୍ଷ୍ମୀଙ୍କ ବଡ ଭାଇ |
1036,ଆପଣ ଆଜି ବିବାହ କରିବାକୁ ଯାଉଛନ୍ତି |
1037,ଆପଣ ରାଜଠାରୁ ଲମ୍ବା ଅଟନ୍ତି |
1038,ଆଜି ରାତିରେ ତୁମେ ଶୀଘ୍ର ଶୋଇବା ଭଲ |
1039,ଆପଣ ବାଲି ଖୋଳିବେ |
1040,ଆପଣ ମୂଳ ଖୋଳିବେ |
1041,ତୁମେ ମୋତେ ମାରି ପାରିବ
1042,ଆପଣ କେବଳ ଲୋକଙ୍କୁ ହତ୍ୟା କରିପାରିବେ ନାହିଁ!
1043,ଆପଣ ବହୁତ ତାରକା ଦେଖିପାରିବେ |
1044,ତୁମେ ମୋତେ ବିଶ୍ୱାସ କରିପାରିବ |
1045,ଆପଣ ଶୀଘ୍ର ଚାଲିପାରିବେ |
1046,ତୁମେ କିଛି ଭୁଲ୍ କହି ନାହଁ |
1047,ଆସନ୍ତାକାଲି ତୁମର ପରୀକ୍ଷା ହେବ |
1048,ତୁମେ ଜାଣିଛ କିପରି ପହଁରିବା |
1049,ତୁମେ ଅସୁସ୍ଥ ଦେଖାଯାଉଛ |
1050,ଆପଣ ଯନ୍ତ୍ରଣାକୁ ସହ୍ୟ କରିବା ଜରୁରୀ |
1051,ଆପଣ ଏହା ଜାଣିବା ଉଚିତ୍ |
1052,ତୁମେ ଏକାଠି କାମ କରିବା ଉଚିତ୍ |
1053,ଆପଣଙ୍କୁ ବିବାହ ପାଇଁ ନିମନ୍ତ୍ରଣ କରାଯିବ |
1054,ଆପଣ ଏହି ଦୋକାନରୁ ଆପଣଙ୍କର ଖାଦ୍ୟ ସାମଗ୍ରୀ ପାଇବେ |
1055,ତୁମେ ବହୁତ ଲମ୍ବା ଜୀବନ ବଞ୍ଚିବ |
1056,ତୁମେ ବହୁତ ଶୀଘ୍ର ଲେଖ |
1057,ତୁମର ଚେହେରା ଲାଲ୍ |
1058,ତୁମର ପ୍ୟାଣ୍ଟ ମଇଳା |
1059,ତୁମର ସମର୍ଥନ ଆମକୁ ବହୁତ ସାହାଯ୍ୟ କରିବ |
