ID,Sentence
609,ସେ ପକ୍ଷୀ ପରି ଗାନ କରନ୍ତି
610,ସେ ଖାଇବା ସମୟରେ କଥା ହେଲା |
611,ସେ ତାଙ୍କୁ ହ୍ରଦକୁ ନେଇଗଲେ
612,ସେ ତାଙ୍କୁ ମାଡ ମାରିବାକୁ ଚାହିଁଲା |
613,ସେ ଲାଲ ରଙ୍ଗର ପୋଷାକ ପିନ୍ଧିଥିଲେ
614,ସେ ଲୁହ ପୋଛି ଦେଲା |
615,"ସେ କଠିନ ପରିଶ୍ରମ କରିଥିଲେ, ତଥାପି ସେ ବିଫଳ ହୋଇଥିଲେ"
616,ସେ ମୋତେ କେବେ ମିଛ କହିବ ନାହିଁ |
617,ସୀତାକୁ ଉଠାଇବାକୁ ସୀଲା ରତ୍ନାକୁ କହିଲା / ସୀଲା ରତ୍ନାକୁ କହିଲା ସୀତାକୁ ଉଠାଅ |
618,କବାଟ ବନ୍ଦ କର |
619,ଗୀତ ଗIଅ
620,ଭଉଣୀ କେବଳ ତାଙ୍କ ସାଙ୍ଗମାନଙ୍କ ସହିତ କିଣା କିଣି କରିବାକୁ ଯିବ |
621,ବସି ପଡ଼
622,ବର୍ତ୍ତମାନ ବସ |
623,ସୀତା ଏକ ପାଚିଲା ଆମ୍ବ ଖାଉଛନ୍ତି |
624,ସୀତା ଆଡେ ସାଡେ / ଏଠି ସେଠି ବୁଲିବାକୁ ଚାହେଁ |
625,ସୀତା ନିଜକୁ ଦର୍ପଣରେ ଦେଖିଲା |
626,ସୀତା କାରରେ ବାନ୍ତି କରନ୍ତି |
627,ଗରମ ବାଷ୍ପରୁ ଚର୍ମ ଜଳିଯାଏ |
628,ସାପ ଘାସଉପରେ (ଘଷିକରି) ଗଲା |
629,ଘାସରେ ସାପ ଲୁଚି ରହିଥିଲା
630,କେତେକ ପଶୁ ଗୃହପାଳିତ ପଶୁ ଅଟନ୍ତି |
631,କିଛି ପକ୍ଷୀ ବହୁତ ସୁନ୍ଦର ଅଟନ୍ତି |
632,କିଛି ପତ୍ର ଔଷଧ ପାଇଁ ବ୍ୟବହୃତ ହୁଏ |
633,କେତେକ ଗାଈ ବାଦାମୀ ରଙ୍ଗର ଅଟନ୍ତି
634,କିଛି ଲୋକ ଚା ପିଅନ୍ତି ନାହିଁ |
635,କିଛି ମୂଳ ଖାଇବା ଯୋଗ୍ୟ |
636,କିଛି ଗଛର ଛେଲି ବହୁତ ନିଦା (କଠିନ)|
637,କିଛି ଗଛ କେବେ ପାତ୍ର ଝଡନ୍ତି ନହିଁ |
638,କୌଣସି ନା କୌଣସି ଦିନ ସେ ମୋ ପାଖକୁ ଫେରି ଆସିବ |
639,ବର୍ଷା ଋତୁରେ ମଞ୍ଜି ଗୁଡିକ ବୁଣ |
640,ଘରଚଟିଆ ପୋକ ଖାଏ |
641,ଶୁଖିବା ପାଇଁ ପୋଷାକକୁ ଚିପୁଡ଼ି ଦିଅନ୍ତୁ |
642,ଡାଲିରେ ଲେମ୍ବୁ ଚିପୁଡ଼ି ଦିଅନ୍ତୁ |
643,ରସ ପାଇଁ ଆମ୍ବକୁ ଚିପୁଡ଼ି ଦିଅନ୍ତୁ |
644,କାନ୍ଥ ନିକଟରେ ଠିଆ ହୁଅ ଏବଂ ଉପରକୁ ଦେଖ ନାହିଁ |
645,ନିଜ ଆସନରୁ ଧୀରେ ଧୀରେ ଠିଆ ହୁଅ |
646,ସୂର୍ଯ୍ୟଙ୍କୁ ଚର୍ମରେ ଅନୁଭବ କରାଯାଇପାରେ |
647,ସୁରେଶ ମସଲାକୁ ହେମଦସ୍ତI ବ୍ୟବହାର କରି ଗୁଣ୍ଡ କଲେ
648,ତୁମର ଓଦା ପୋଷାକ କାଢି ଦିଅ |
649,ବାମ ପାର୍ଶ୍ୱରେ ରାସ୍ତା ନିଅନ୍ତୁ |
650,କ୍ଷେତ ଦେଇ କ୍ଷୁଦ୍ର ପଥ ନିଅନ୍ତୁ |
651,ଶିକ୍ଷକ ଆମକୁ କାନର କାର୍ଯ୍ୟ ବିଷୟରେ ଶିଖାଇଲେ |
652,ଅନୁଶାସନ ବଜାୟ ରଖିବା ପାଇଁ ଶିକ୍ଷକ ବାଡ଼ି ବ୍ୟବହାର କରିଥିଲେ |
653,ସେହି କଳାଟି ମୋର ଅଟେ |
654,ସେହି ବିଲେଇ ତୁମକୁ ରାମ୍ପୁଡ଼ି ଦବ |
655,ତାହା ହେଉଛି ଏକ କଦଳୀ ଗଛ |
656,ତାହା ଏକ ବଡ ପର୍ବତ |
657,ତାହା ହେଉଛି ଏକ ଆଦିବାସୀ ଉପନିବେଶ |
658,ତାହା ହେଉଛି ପାହାଡ ତଳେ ମୋର ଘର |
659,ତାହା ହେଉଛି ରମେଶଙ୍କ କୁକୁର
660,ବେଲୁନ୍ ବାୟୁରେ ଭାସିବାକୁ ଲାଗିଲା |
661,କଣ୍ଟାରେ ଟଙ୍ଗାଯାଇଥିବା ଟୋକେଇଟି ଖସିଗଲା |
662,ବଡ କୁକୁର ବିଲେଇକୁ ଗୋଡ଼ାଇଲା
663,ପକ୍ଷୀଟି ପୋଖରୀରୁ ଏକ ମାଛ ଧରିଲା |
664,ଏହା ଏକ ଘରଚଟିଆ ପକ୍ଷୀ |
665,ପକ୍ଷୀଟି ତାର ପକ୍ଷ ବିସ୍ତାର କଲା
666,ବହିଟି ଟେବୁଲ ଉପରେ ଅଛି |
667,ବୋତଲ ଭାଙ୍ଗିଗଲା |
668,ପାତ୍ରଟି ସମ୍ପୂର୍ଣ୍ଣ ରୂପେ ଗୋଲାକାର ଥିଲା |
669,ପିଲାଟି ଏକ କଦଳୀ ଖାଇଲା |
670,ପିଲାଟି କୂଅରେ ପଡ଼ିଗଲା
671,ପିଲାଟି ଖେଳୁଛି |
672,ପିଲାଟି ଏକ ବଲ ସହିତ ଖେଳୁଛି |
673,ପିଲାଟି ଭଲ ଖେଳିଲା |
674,ପିଲାଟି ପଥର ଫିଙ୍ଗିଲା
675,ଜ୍ୱରରେ ପୀଡିତ ପିଲାଟିର ଗତକାଲି ମୃତ୍ୟୁ ଘଟିଛି
676,ଏହି ବାଲଟି ରେ ପାଣି ରହି ପାରିବ ନହିଁ |
677,ଏହି ଶାଗବିଡା ବହୁତ ମୋଟ |
678,ମୋଚି ମେଣ୍ଢା ର ଅନ୍ତନାଡି ବାହାର କରି ଦେଲା
679,ବିଲେଇଟି ନିଆଁ ପାଖରେ ଅଛି |
680,ବିଲେଇ ସୂର୍ଯ୍ୟକିରଣରେ ଶୋଇଛି
681,ସଁଅବାଲୁଆ ଟି ଗାଢ଼ ସବୁଜ ରଙ୍ଗର ଥିଲା
682,କୁକୁଡ଼ାମାନେ ବହୁତ ଛୋଟ |
683,ପିଲାଟି ତାଙ୍କ ଭଉଣୀକୁ ଆଘାତ କରିନଥିଲା
684,ପିଲାଟି ଏକ ଗ୍ଲାସ କ୍ଷୀର ପିଇଲା |
685,ଫୁଟପାଥରେ ଯିବାବେଳେ ପିଲାଟି ତଳେ ପଡ଼ିଯାଇଥିଲା
686,ପିଲାଟି ଚାଲିବା ସମୟରେ ତଳେ ପଡ଼ିଯାଇଥିଲା।
687,ପିଲାଟି ନିର୍ଦ୍ଦୋଷ |
688,ପିଲାଟି ପୋଖରୀ ଉପରେ ଚଢ଼ିଗଲା |
689,ପିଲାମାନେ ଆମ୍ବକୁ ଛୁରୀରେ କାଟି ଦେଇଥିଲେ
690,କପଡା ବହୁତ ମୋଟା |
691,ମେଘ ଅନ୍ଧାର ହୋଇଯାଉଛି |
692,ମେଘ ସୂର୍ଯ୍ୟଙ୍କୁ ଲୁଚାଇଲା
693,ପାତ୍ରଟି ମୋ ମୁଣ୍ଡରେ ପଡିଗଲା
694,କପା ପବନରେ ଉଡି ଆସିଲା |
695,ଗାଈ ର ଏକ ଭଙ୍ଗା ଶିଙ୍ଗ ଅଛି |
696,ପରଦାଟି ନିଆଁକୁ ଆୟତ୍ତ କରିଥିଲା
697,କଟାଟି ଫୁଲିପାରେ |
698,ଡେସ୍କଟି ଧୂଳିରେ ଆଚ୍ଛାଦିତ |
699,ଡାକ୍ତର ଅସୁସ୍ଥତା ନିଶ୍ଚିତ କଲେ |
700,କୁକୁରଟି ପୋଖରୀରେ ଭାସୁଛି
701,କୁକୁରଟି ଖୁସିରେ ତା ଲାଞ୍ଜ ହଲାଉଛି |
702,କୁକୁରଟି ଖୁସିରେ ତା ଲାଞ୍ଜ ହଲାଉଛି |
703,କୁକୁର ଭୁକିବାରେଙ୍କ ଝିଅ ପାଇଁ ରୋଷେଇ କରିବେ |
704,ଦ୍ଵାରଟି ସଂକୀର୍ଣ୍ଣ ଅଟେ |
705,ଦ୍ଵାରଟି ଏହାର ଉଚ୍ଚତା ଅନୁପାତରେ ସଂକୀର୍ଣ୍ଣ ଅଟେ |
706,ପୃଥିବୀ ଗୋଲାକାର |
707,ପୃଥିବୀ ଘୂର୍ଣ୍ଣନ କରେ |
708,ହାତୀ ଛୁଆଟି ନିଜ ମା ସହିତ ଖେଳିଲା |
709,ଖସିପଡିଥିବା ଲୋକଟି ଦଉଡିଟିକୁ ଧରିଥିଲା
710,ବାପା ପିଲାମାନଙ୍କ ପାଇଁ ଖେଳନା କିଣିଥିଲେ |
711,ପରଟି ବହୁତ ହାଲୁକା |
712,ଜ୍ୱରଟି ଶୀଘ୍ର ଭାଲାହୋଇ ଯିବ |
713,ଜ୍ୱରର ବାଳକଟି ମରିଗଲା
714,ପ୍ରଥମ ଦଉଡି କାଟି ଦିଆଗଲା |
715,ମାଛଟି ପଚା ଅଟେ |
716,ଫୁଲର ପୁଷ୍ପଗୁଡ଼ିକ ବହୁତ ଚିକ୍କଣ |
717,କୁହୁଡିଟି ଅଦୃଶ୍ୟ ହେବା ଆରମ୍ଭ ହେଲା |
718,କୁହୁଡି ପତଳା ହେବାକୁ ଲାଗୁଛି
719,ସକାଳେ କୁହୁଡି ଘନ ହୋଇଯାଇଥିଲା
720,ଖାଦ୍ୟଟି ଥଣ୍ଡା ଅଟେ |
721,ଖାଦ୍ୟଟି ଖାଇବାକୁ ଅତ୍ୟଧିକ ଗରମ ଅଟେ |
722,କଦଳୀ ପତ୍ରରେ ଖାଦ୍ୟ ପରିବେଷଣ କରାଯାଉଥିଲା |
723,ଏହି ଖାଦ୍ୟ ପିଲା ଖାଇବ ନାହିଁ |
724,ପିଲାଟି ଶୀଘ୍ର ଶୀଘ୍ର ଖାଦ୍ୟ ଖାଇବା ଉଚିତ ନୁହେଁ |
725,ଜଙ୍ଗଲ ମାଇଲ୍ ମାଇଲ୍ ପର୍ଯ୍ୟନ୍ତ ବ୍ୟାପିଛି |
726,ଜଙ୍ଗଲ ଥଣ୍ଡା ଏବଂ ଛାଇ ଜଣାପଡୁଥିଲା |
727,ଜଙ୍ଗଲ ଅଧିକାରୀ କାଠକଟାଳିକୁ ଗଛ କାଟିବାରେ ଲାଗିଛନ୍ତି |
728,ଗଙ୍ଗା ଜଳ ସବୁଠାରୁ ଶୁଦ୍ଧ ଅଟେ |
729,ଝିଅଟି ଖାଇ ସାରିଥିଲା
730,ମୋ ଛାତିରୁ ଗୋଟେ ଭାରୀ ଭାର ଉଠି ଗଲା |
731,ଏଠାରେ ପାଖରେ ଏକ ଡାକ୍ତରଖାନା ଅଛି |
732,ଘରଟି ନିଆଁରେ ଜଳି ପାଉଁଶ ହୋଇଗଲା |
733,ଟାଙ୍ଗିଆ ଟୋକେଇ ତଳେ ପଡ଼ିଗଲା
734,ସ୍ୱାମୀ ଜଙ୍ଗଲରୁ କାଠ ଆଣିଥିଲେ
735,ବରଫ ବହୁତ ମୋଟା ଅଟେ |
736,ବରଫ ସୂର୍ଯ୍ୟକିରଣରେ ତରଳି ଗଲା |
737,ବରଫ ଶୀଘ୍ର ଲୋପ ପାଇବ |
738,ନିରୀହ ପିଲା
739,ହ୍ରଦ ଏଠାରେ ଗଭୀର ଅଟେ |
740,ହ୍ରଦ / ପୋଖରୀ ଏଠାରେ ଗଭୀର |
741,ପତ୍ରଗୁଡ଼ିକ ଶରତରେ ଗଛରୁ ଖସିଯାଏ |
742,ଛୋଟ ପିଲାଟି ଏକ ମାଛ ଧରିଲା |
743,ମନୁଷ୍ୟ ଅଜ୍ଞ ଅଟେ |
744,ବ୍ୟକ୍ତି ଜଣକ ତାଙ୍କୁ ନଦୀରେ ଡେଇଁବାକୁ ଅଟକାଇଲେ
745,ଲୋକଟି କୋଠରୀ ଭିତରକୁ ଗଲା
746,ଭୋଜନ ଥଣ୍ଡା ହୋଇଗଲା |
747,ଆଜି ରାତିରେ ଚନ୍ଦ୍ର ଏବଂ ତାରାମାନେ ସ୍ପଷ୍ଟ ଭାବରେ ଦେଖାଯାଈ ଥିଲେ |
748,ଚନ୍ଦ୍ର ବାହାରିଛି
749,ଚନ୍ଦ୍ର ମେଘ ପଛରେ ଅଛି |
750,ଚନ୍ଦ୍ର ଉଜ୍ଜ୍ୱଳ ଅଟେ
751,ଚନ୍ଦ୍ର ଉଜ୍ଜ୍ୱଳ |
752,ମା ଟି ସ୍ନେହ ର ସହିତ ପିଲାମାନଙ୍କୁ ବଢାଇ ଥିଲେ |
753,ପର୍ବତଗୁଡିକ ସୁନ୍ଦର ଦେଖାଯାଉଥିଲା |
754,ନୂଆ ଜୋତା ମୋ ପାଇଁ ଛୋଟ |
755,ବୃଦ୍ଧ ହାତୀଟି ମରି ନାହିଁ
756,ବୃଦ୍ଧ ହାତୀର ମୃତ୍ୟୁ ଘଟିଛି
757,ବୃଦ୍ଧ ଜଣକ ବାଡ଼ି ବ୍ୟବହାର କରି ଚାଲନ୍ତି
758,ମୟୂରର ସୁନ୍ଦର ପୁଚ୍ଛ ଅଛି |
759,ସ୍ଥାନଟି ବହୁତ ଦୂରରେ ନୁହେଁ |
760,ପୋଖରୀ ଶୁଖି ଯାଇଛି
761,ପୋଖରୀଟି ସମ୍ପୂର୍ଣ୍ଣ ରୂପେ ବରଫ ହୋଇଯାଇଥିଲା |
762,ନାଲି ପକ୍ଷୀ ଶୀଘ୍ର ଉଡିଗଲା |
763,ଚୂନା ବହୁତ ଶୁଖିଲା ଅଟେ |
764,ନଦୀ ବହୁତ ଦ୍ରୁତ ଗତିରେ ପ୍ରବାହିତ ହେଉଛି |
765,ନଦୀ ପଶ୍ଚିମ ଦିଗକୁ ପ୍ରବାହିତ ହେଉଛି
766,ନଦୀ ବହୁତ ପ୍ରଶସ୍ତ |
767,ନଦୀ ଜଳ କାଦୁଅରେ ପରିଣତ ହୋଇଛି
768,କାରଗୁଡିକ ପାଇଁ ରାସ୍ତା ବହୁତ ସଂକୀର୍ଣ୍ଣ |
769,ରାସ୍ତାଟି ବହୁତ ଖରାପ ଥିଲା |
770,କୋଠରୀଟି ଗରମ ଥିଲା
771,ରୋଟି ଗରମ ଏବଂ ନରମ ଅଟେ |
772,ଆଜି ସମୁଦ୍ରରେ ବହୁତ ଉଚ୍ଚ ତରଙ୍ଗ ଥିଲା |
773,ଆଜି ସମୁଦ୍ର ଶାନ୍ତ ଅଛି |
774,ସମୁଦ୍ର ଗଭୀର ନୀଳ ରଙ୍ଗର |
775,ସମୁଦ୍ରର ଜଳ ଲୁଣିଆ |
776,ଭଉଣୀଟି ଛୋଟ ଭାଇକୁ ଶୁଆଈ ଦେଉଛି |
777,ଆକାଶ ନୀଳ |
778,ଆକାଶ ତାରାଗୁଡ଼ିକରେ ପରିପୂର୍ଣ୍ଣ |
779,ଆଜି ଆକାଶ ବହୁତ ସ୍ୱଚ୍ଛ |
780,ଗତକାଲି ଆକାଶ ସ୍ପଷ୍ଟ ହୋଇଥିଲା
781,ଆକାଶ ସଂପୂର୍ଣ୍ଣ ଅନ୍ଧକାରମୟ ଥିଲା |
782,ତାରାମାନେ ରାତିରେ ବାହାରକୁ ଆସିଲେ |
783,ପଥରଟି ତାଙ୍କୁ ଆଘାତ କଲା
784,ରାସ୍ତାଗୁଡ଼ିକ ବହୁତ ସଂକୀର୍ଣ୍ଣ |
785,ଛାତ୍ର ଉତ୍ତର ଦେବା ପୂର୍ବରୁ କିଛି ସମୟ ଚିନ୍ତା କଲା |
786,ଛାତ୍ର ଉତ୍ତର ଦେବା ପୂର୍ବରୁ କିଛି ସମୟ ଚିନ୍ତା କଲା |
787,ସୂର୍ଯ୍ୟ ଆଲୋକ ଏବଂ ଉତ୍ତାପ ଦେଇଥାଏ |
788,ସୂର୍ଯ୍ୟ ଅସ୍ତ ହୋଇଗଲେ
789,ସୂର୍ଯ୍ୟ ଅସ୍ତ ହେବାକୁ ଯାଉଛି
790,ଜୀବନ ପାଇଁ ସୂର୍ଯ୍ୟ ଅତ୍ୟନ୍ତ ଜରୁରୀ |
791,ସକାଳେ ସୂର୍ଯ୍ୟ ଉଦୟ ହୁଅନ୍ତି |
792,ଆଜି ସୂର୍ଯ୍ୟ ଉଜ୍ଜ୍ୱଳ ଆଲୋକିତ କଲା |
793,ଶୀଘ୍ର ସୂର୍ଯ୍ୟ ଉଦୟ ହେବେ |
794,ଲାଞ୍ଜ କଟା ମାଙ୍କଡ଼ ବିରକ୍ତିକର ଥିଲା |
795,ଶିକ୍ଷକ ଆମକୁ ଚେୟାରରେ ଠିଆ କରାଇଲେ |
796,ପତଳା ଝିଅଟି ଖୁବ ଜୋରରେ ଦୌଡିଲା |
797,ପତଳା କାଚଟି ଭଙ୍ଗୁରିଅ ଅଟେ |
798,ବନ୍ୟା ଯୋଗୁଁ ଟ୍ରେନ୍ ବିଳମ୍ବ ହୋଇଥିଲା
799,ଗଛଟି ଉପୁଡି ପଡିଲା |
800,ଗଛଗୁଡ଼ିକ ସବୁଜ |
801,କୂଅ ଶୁଖିଲା ଅଛି |
802,ପତ୍ନୀ ଏକ ସ୍ୱାଦିଷ୍ଟ ଭୋଜନ ରାନ୍ଧିଲେ |
803,ଆଜି ପବନ ବହୁତ ଭଲ ଅନୁଭବ ହେଉଛି |
804,ପବନ ବହୁଛି
805,ପବନ ବନ୍ଦ ହୋଇଗଲା
806,ମହିଳାଙ୍କର ଲମ୍ବା କଳା କେଶ ଅଛି |
807,ନାରୀ ବହୁତ ଦୟାଳୁ |
808,ସାନ ପିଲାଟି ବଡ ପିଲାଠାରୁ ଅଧିକ ଚତୁର ଅଟେ |
809,ସେମାନଙ୍କର ଚାପଟିସ୍ ବହୁତ ପତଳା |
810,ସେମାନଙ୍କର ପାଦ ଅପରିଷ୍କାର ଅଟେ
811,ଜଙ୍ଗଲରେ ଅନେକ ପକ୍ଷୀ ଅଛନ୍ତି |
812,ଆଜି ରାତିରେ ଅନେକ ମଶା ଅଛନ୍ତି |
813,ପୃଥିବୀରେ ଅନେକ ପ୍ରଜାତିର ଉଦ୍ଭିଦ ଅଛି |
814,ଆକାଶରେ କୌଣସି ମେଘ ନହିଁ |
815,କୌଣସି ମସଲା ବାକି ନାହିଁ |
816,ବିଭିନ୍ନ ପ୍ରକାରର ସାପ ଅଛନ୍ତି|
817,ପୋଖରୀରେ ତିନୋଟି କଙ୍କଡା ଅଛି |
818,ଗଛ ଉପରେ ତିନୋଟି ବସା ଅଛି |
819,ରାସ୍ତାରେ ଏକ ଗଛ ପଡିଛି |
820,ମୋ ଘର ପଛରେ ଏକ ବଗିଚା ଅଛି |
821,ସେହି ଘରୁ ଏକ ଆଲୋକ ଆସୁଛି |
822,ଟିକିଏ ପବନ ଅଛି |
823,ମୋ ଘର ସାମ୍ନାରେ ଆମ୍ବ ଗଛ ଅଛି |
824,ଆକାଶରେ ଇନ୍ଦ୍ରଧନୁ ଅଛି |
825,ସେଠାରେ ଏକ ଲାଲ ଆଖି ଷଣ୍ଢ ଅଛି
826,ଏହି ଗାଁରେ ଏକ ଛୋଟ ପୋଖରୀ ଅଛି |
827,ମୋ ଘର ପଛରେ ଏକ ଘନ ଜଙ୍ଗଲ ଅଛି |
828,ମାଂସ ଉପରେ ଏକ ମୋଟା ଚର୍ବି ଅଛି |
829,ସେହି ପାହାଡ ପଛରେ ଏକ ଜଳପ୍ରପାତ ଅଛି |
830,ଟେବୁଲ ଉପରେ ଧୂଳି ଅଛି |
831,ହ୍ରଦରେ କମଳ ଫୁଲୁଛି |
832,ମୋ ଗଣନା ଅନୁଯାୟୀ ଅଧିକ ଟଙ୍କା ଅଛି |
833,ଆଉ ଲୁଣ ନାହିଁ |
834,କୌଣସି ମସଲା ବାକି ନାହିଁ |
835,ପୋଖରୀରେ ପାଣି ନାହିଁ
836,ଆଜି ପବନ ନାହିଁ
837,ଆକାଶରେ ମେଘ ନାହିଁ |
838,ହାଣ୍ଡିରେ ଗୋଟିଏ ମାଛ ଅଛି |
839,ରାସ୍ତାରେ ଏକ ମୃତ କୁମ୍ଭୀର ଥିଲା
840,ମୋ ପାଦରେ ଗୋଟିଏ ଜୋକ ଥିଲା
841,ତା ଚର୍ମରେ ଏକ କାଟଦାଗ ଥିଲା |
842,ପଲରେ ପାଞ୍ଚଟି ଧଳା ପକ୍ଷୀ ଥିଲେ
843,ଏଗୁଡ଼ିକ ଭଲ କଦଳୀ |
844,ଏହି ଔଷଧ ଗୁଡ଼ିକ ଯକୃତ ପାଇଁ ଭଲ |
845,ଏହି ପ୍ୟାଣ୍ଟଗୁଡିକ ମଇଳା ଅଟେ |
846,ସେମାନେ ବଲ୍ ସହିତ ଖେଳୁଛନ୍ତି |
847,ସେମାନେ ବହୁତ ଶୀଘ୍ର ନାଚନ୍ତି |
848,ସେମାନେ ବଞ୍ଚିବାକୁ ଆଶା କରନ୍ତି ନାହିଁ
849,ସେମାନେ ସମସ୍ତଙ୍କୁ ଶହେ ଟଙ୍କା ଦେଇଥିଲେ
850,ସେମାନେ ସମସ୍ତଙ୍କୁ ଟିକେଟ୍ ଦେଇଥିଲେ
851,ସେମାନେ ସବୁଜ ଲାଇଟ୍ ଅନ୍ କରିଛନ୍ତି |
852,ସେମାନେ ରାତିରେ ଶିକାର କରନ୍ତି
853,ସେମାନେ ତାଙ୍କୁ ଫେରିବାକୁ ଦେଲେ
854,ସେମାନେ ବିଦ୍ୟାଳୟ ନିକଟରେ ରୁହନ୍ତି |
855,ସେମାନେ ଏକାଠି ଗୀତ ଗାଇବାକୁ ଭଲ ପାଆନ୍ତି |
856,ସେମାନେ ବାଡ଼କୁ ସବୁଜ ରଙ୍ଗ କରିଥିଲେ
857,ସେମାନେ ନିଆଁ ପାଖରେ ବସିଲେ
858,ସେମାନେ ଗରିବ ଲୋକଙ୍କୁ ସମର୍ଥନ କରନ୍ତି
859,ସେମାନେ ଗରିବ ଲୋକଙ୍କୁ ସମର୍ଥନ କରନ୍ତି
860,ସେମାନେ ସେଠାରେ ମନ୍ଦିରରେ ଏକାଠି ହେବାକୁ ଚାହାଁନ୍ତି
861,ସେମାନେ ଆମକୁ ସେମାନଙ୍କ ସ୍ଥାନରେ ଏକତ୍ର କରିବାକୁ ଚାହାଁନ୍ତି |
862,ସେମାନେ ସେମାନଙ୍କର ଅତିଥିମାନଙ୍କୁ ହସ ସହିତ ସ୍ୱାଗତ କରନ୍ତି |
863,ସେଗୁଡିକ ସଂପୂର୍ଣ୍ଣ ପାଣିରେ ଭିଜାଇ ଦିଆଯାଇଥିଲା |
864,ସେମାନେ ବହୁତ ଲମ୍ବା ଡୋସା ରାନ୍ଧୁଥିଲେ |
865,ସେମାନେ ସେମାନଙ୍କର କାର୍ଯ୍ୟ ଏଠାରେ ଦାଖଲ କରିବେ |
866,ସେମାନେ ବହୁତ କଠିନ ପରିଶ୍ରମ କରନ୍ତି |
867,ଏହି କମ୍ବଳ ଗରମ ଅଟେ |
868,ଏହି କପଡା ଚିକ୍କଣ ଅନୁଭବ କରେ |
869,ଏହି କପଡ଼ାର ସଂକୀର୍ଣ୍ଣ ଓସାର ଅଛି |
870,ଏହି ହାତୀଟି ପୂର୍ବ ଅପେକ୍ଷା ବଡ ଅଟେ
871,ଏହି କପଡ଼ାର ସଂକୀର୍ଣ୍ଣ ଓସାର ଅଛି |
872,ମଞ୍ଜି ବୁଣିବା ପାଇଁ ଏହା ଏକ ଭଲ ସମୟ |
873,ଏହା ଏକ ଆମ୍ବ ଉଦ୍ଭିଦ |
874,ଏହା ଅତ୍ୟନ୍ତ ମୋଟା ଘୁଷୁରି |
875,ଏହା ଆମ୍ବ ଉଦ୍ଭିଦ |
876,ଏହା ମୋର ଉଦ୍ୟାନ |
877,ଏହା ଏକ କଖାରୁ ଉଦ୍ଭିଦ ନୁହେଁ |
878,ଏହା ପୃଥିବୀର ସର୍ବୋତ୍ତମ ଜିନିଷ |
879,ଏହା ଏକ ଟୋକେଇ ବୁଣିବାର ପଦ୍ଧତି |
880,ଏହା କାଠ ଟେବୁଲ୍ |
881,ଏହା ତୁମର କାମ କରିବା ସ୍ଥାନ |
882,ଏହି କୁର୍ତ୍ତା ମୋ ପାଇଁ ବହୁତ ଛୋଟ |
883,ଏହି ହ୍ରଦ ଗଭୀର ଅଟେ |
884,ଏହି ବ୍ୟକ୍ତି ଦୁର୍ନୀତିଗ୍ରସ୍ତ କିନ୍ତୁ ମୁଁ ନୁହେଁ |
885,ଏହି ବ୍ୟକ୍ତି ପରିବାରର ମୁଖ୍ୟ ଅଟନ୍ତି |
886,ଏହି ସ୍ଥାନଟି ବହୁତ ମଇଳା |
887,ଏହି ନଦୀ ସୁନ୍ଦର ଅଟେ |
888,ଏହି ରାସ୍ତା ଶାନ୍ତିଙ୍କ ଘରକୁ ଯାଏ |
889,ଏହି ରାସ୍ତା ବିପଜ୍ଜନକ ଅଟେ |
890,ଏହି ଚପଲଟି ମୋ ପାଦରେ ଫିଟ୍ ନାହିଁ |
891,ଏହି ବାଡି ବହୁତ ଲମ୍ବା ଅଟେ |
892,ଏହି ଗଛର ବହୁତ ବଡ ଶାଖା ଅଛି |
893,ଏହି ଗାଁ ବଡ |
894,ଏହି ପ୍ରଶସ୍ତ ରାସ୍ତା ଲତାଙ୍କ ଘରକୁ ଯାଏ |
895,ଏହି କାଠ ପଟା ବହୁତ ପ୍ରଶସ୍ତ |
896,ଗତକାଲି ରାତିରେ ଏଠାରେ ତିନୋଟି ସାପ ଦେଖିବାକୁ ମିଳିଥିଲା |
897,ଭଙ୍ଗା ଶାଖା ଫିଙ୍ଗିଦିଅ |
898,ଏହାକୁ ଘରୁ ବାହାରକୁ ଫିଙ୍ଗିଦିଅ |
899,ଏହାକୁ ମୋ ପାଖକୁ ଫୋପାଡି ଦିଅ |
900,ବଲ୍ ଫିଙ୍ଗିଦିଅ |
901,ଏହାକୁ ପୁଣି ବାନ୍ଧ |
902,ଦଉଡିର ଶେଷରେ ଡଙ୍ଗାକୁ ବାନ୍ଧ |
903,ଗୋରୁମାନଙ୍କୁ ଏକତ୍ର ବାନ୍ଧ |
904,ବାଡ଼ିଟି ଦଉଡି ଶେଷରେ ବାନ୍ଧ |
905,ମଞ୍ଜି ବୁଣିବା ପାଇଁ ଆଜି ଏକ ଭଲ ଦିନ |
906,ଆସନ୍ତାକାଲି ରାତିରେ ଆମେ ମାଛ ଧରିବାକୁ ଯିବା |
907,ଗଛର ଗଛର ଅନେକ ଔଷଧ ବ୍ୟବହାର ଅଛି |
908,ଗଛରେ ଅନେକ ପଶୁ ବାସ କରନ୍ତି |
909,ଗଛର ଟ୍ରଙ୍କ ଭିତରେ ଫାଙ୍କା ଥିଲା |
910,ଗଛ ଆମକୁ ଫଳ ଦେଇଥାଏ |
911,ଗଛ କଟା ହେଲା
912,କାଟି ଯାଇଥିବା ସ୍ଥାନକୁ କୁଣ୍ଡାଇବାକୁ ଚେଷ୍ଟା କର ନାହିଁ |
913,ସେମାନଙ୍କ ମଧ୍ୟରୁ ଦୁଇଜଣ ଦଳର ନେତୃତ୍ୱ ନେବାକୁ ବାଛିଥିଲେ
914,ଦୁଇଟି ବହି ଚୋରି ହୋଇଥିଲା |
915,ବାଡ଼ି ବ୍ୟବହାର କରି ପାତ୍ର ଗୁଡିକୁ ତୋଳ|
916,ଗାଁର ପାଗ ଆର୍ଦ୍ର କିନ୍ତୁ ସହରର ପାଗ ଶୁଖିଲା |
917,ପୋଷାକ ଧୋଇ ଦିଅ |
918,ମୁହଁକୁ ସଠିକ୍ ଭାବରେ ଧୋଇ ଦିଅ |
919,ଧୋଇବା ଦ୍ୱାରା ତାଙ୍କ କେଶର ଉକୁଣି ନଷ୍ଟ ହେବ ନାହିଁ |
920,ଜଳ ପ୍ରଦୂଷିତ ହୋଇଛି |
921,ଉଦ୍ଭିଦଗୁଡିକୁ ଭଲ ଭାବରେ ପାଣି ଦିଅନ୍ତୁ |
922,ଆମେ ଏପର୍ଯ୍ୟନ୍ତ ଭଲ କାମ କରୁଛୁ |
923,ଆମେ ସେ ପର୍ବତ ଉପରକୁ ଚଢିବାକୁ ଯାଉଛୁ |
924,ଆମେ ଏଥିରେ ଏକାଠି ଅଛୁ |
925,ଏହି ସଂଗ୍ରାମରେ ଆମେ ଏକାଠି ଅଛୁ |
926,ଆମେ ଦୁଇ ଭାଇଭଉଣୀ |
927,ଆମେ ଏକ ଗୋଲାକାର ଟେବୁଲ୍ କିଣିଲୁ |
928,ଆମେ ସେଠାରେ ଏକ ବଡ଼ ପର୍ବତ ଦେଖିପାରିବା |
929,ଆଜି ରାତିରେ ଆମେ ଅନେକ ତାରା ଦେଖିପାରିବା |
930,ଆଜି ଆମେ ଏକ ଭାରି ମାଛ ଧରିଲୁ |
931,କୁହୁଡି ବ୍ୟତୀତ ଆମେ ଆଉ କିଛି ଦେଖି ପାରିଲୁ ନାହିଁ |
932,ଆମେ ଡଙ୍ଗାରେ ନଦୀ ପାର ହୋଇଥାଉ |
933,ଆମେ ଏକ ସଂକୀର୍ଣ୍ଣ ସେତୁ ପାର ହୋଇଗଲୁ |
934,ଆମେ ଏକାଠି ଆମର ଖାଦ୍ୟ ଖାଇଥାଉ |
935,ଆମେ ଏହି ଉଦ୍ଭିଦର ମୂଳ ଖାଇଥାଉ |
936,ଶେଷରେ ଆମେ ହ୍ରଦରେ ପହଞ୍ଚିଲୁ |
937,ଶେଷରେ ଆମେ ଯାହା ଚାହୁଁଥିଲୁ ତାହା ପାଇଲୁ |
938,ଆମେ ଗର୍ତ୍ତରେ କିଛି ପଶୁ ହାଡ ପାଇଲୁ |
939,ଆମେ ଚାରିଜଣ ବନ୍ଧୁ ଥିଲୁ |
940,ଆମେ ବସ୍ ନେଇ ସେଠାରେ ପହଞ୍ଚିବା |
